{
  "schema_version": "1.0.0",
  "run_id": "sample-run",
  "scenario_id": "sessions:s129_checkout_price_changed",
  "scenario_instance_id": "b8576ec7-ebad-5318-b720-54174c381171",
  "attempt": 1,
  "event_id": "event-snapshot-1",
  "snapshot_id": "snapshot-1",
  "original_turn_index": 12,
  "request_id": "request-1",
  "phase": "after",
  "captured_at": "2026-09-29T08:30:01+00:00",
  "state": {
    "projection_version": "example-v1",
    "order_count": 0
  },
  "unavailable_sections": [
    "quote"
  ]
}
